{
    "$schema": "http://json-schema.org/draft-07/schema#",
    "$id": "https://example.com/crm-file-processor/profile_v2.schema.json",
    "title": "CRM File-Processor â€“ Profile v2",
    "description": "Declarative configuration for each vendor file feed.",
    "type": "object",
    "required": [
        "parserId",
        "maxBytes",
        "maxRows",
        "rowStateMachineArn",
        "mapMaxConcurrency",
        "targets"
    ],
    "properties": {
        "parserId":          { "type": "string", "enum": ["csv_pipe","fixed_width","xlsx_sheet"] },
        "maxBytes":          { "type": "integer", "minimum": 1 },
        "maxRows":           { "type": "integer", "minimum": 1 },
        "rowStateMachineArn":{ "type": "string",  "pattern": "^arn:aws:states:[a-z0-9-]+:\\d{12}:stateMachine:[A-Za-z0-9-_]+$" },
        "mapMaxConcurrency": { "type": "integer", "minimum": 1, "maximum": 10000 },
        "rowValidation": {
            "type": "object",
            "properties": {
                "required": { "type": "array", "items": { "type": "string" } },
                "regex":    { "type": "object", "additionalProperties": { "type": "string" } }
            },
            "additionalProperties": false
        },
        "preProcessors":  { "type": "array", "items": { "type": "object" } },
        "enrichments":    { "type": "array", "items": { "type": "object" } },
        "targets": {
            "type": "array",
            "minItems": 1,
            "items": {
                "type": "object",
                "required": ["object", "externalId", "fieldMap"],
                "properties": {
                    "object":     { "type": "string" },
                    "externalId": { "type": "string" },
                    "fieldMap":   { "type": "object", "additionalProperties": { "type": "string" } },
                    "link":       { "type": "object", "additionalProperties": { "type": "string" } },
                    "postCreateRules": { "type": "array", "items": { "type": "object" } }
                },
                "additionalProperties": false
            }
        }
    },
    "additionalProperties": false
}
